{
  "schema_id": "ywe.diagnostic_noop.v1",
  "version": "1.0.0",
  "noop_id": "noop.perception.example.001",
  "reason": "presentation_only",
  "source_context": {
    "player_id": "player.example",
    "branch_id": "branch.example",
    "location_id": "location.example",
    "player_action_trace_ref": "trace.look_at_rune"
  },
  "evaluation": {
    "summary": "Player perceived a rune shimmer, but no persistent state changed.",
    "truth_scope": "player_perception",
    "guardrail_notes": [
      "Perception did not rewrite shared truth."
    ]
  },
  "provenance": {
    "ash_pattern_diagnostic_ref": "asp.diagnostic.example",
    "source_cosmology_refs": [
      "P3_Astral",
      "P4_Mental"
    ]
  }
}
